product_name,reviews,rating,date
Apple AirPods Pro (2nd Generation),Amazing sound quality and noise cancellation. Worth every penny!,5.0,2024-01-01
Sony WH-1000XM4 Wireless Noise Cancelling Headphones,Best noise cancelling headphones I've ever used. Battery life is incredible.,5.0,2024-01-01
Samsung Galaxy Buds2 Pro,Good sound but battery life could be better,4.0,2024-01-01
Jabra Elite 85t True Wireless Earbuds,Comfortable fit and great call quality,4.5,2024-01-01
Bose QuietComfort 35 II,Classic comfort and sound quality. A bit expensive though,4.0,2024-01-01
Apple AirPods Pro (2nd Generation),Perfect integration with iPhone. Transparency mode is fantastic,5.0,2024-01-02
Sony WH-1000XM4 Wireless Noise Cancelling Headphones,Excellent for travel and work. App could be better,4.5,2024-01-02
Samsung Galaxy Buds2 Pro,Nice upgrade from previous model. ANC is much improved,4.5,2024-01-02
Jabra Elite 85t True Wireless Earbuds,Good but occasional connection issues,3.5,2024-01-02
Bose QuietComfort 35 II,Still holding up well after years. Build quality is excellent,4.5,2024-01-02
Apple AirPods Pro (2nd Generation),The noise cancellation is incredible for such small earbuds,5.0,2024-01-03
Sony WH-1000XM4 Wireless Noise Cancelling Headphones,Perfect for both music and calls. Multi-device connection is handy,5.0,2024-01-03
Samsung Galaxy Buds2 Pro,Great sound quality but case feels a bit cheap,4.0,2024-01-03
Jabra Elite 85t True Wireless Earbuds,Solid performance for the price point,4.0,2024-01-03
Bose QuietComfort 35 II,Comfortable for long sessions but showing its age,3.5,2024-01-03
Apple AirPods Pro (2nd Generation),Battery life could be better but sound quality makes up for it,4.5,2024-01-04
Sony WH-1000XM4 Wireless Noise Cancelling Headphones,Fantastic sound customization options. Very happy with purchase,5.0,2024-01-04
Samsung Galaxy Buds2 Pro,Good integration with Samsung phones. ANC is decent,4.5,2024-01-04
Jabra Elite 85t True Wireless Earbuds,Average battery life but great sound,4.0,2024-01-04
Bose QuietComfort 35 II,Starting to look dated compared to newer models,3.0,2024-01-04
Apple AirPods Pro (2nd Generation),The spatial audio feature is mind-blowing,5.0,2024-01-05
Sony WH-1000XM4 Wireless Noise Cancelling Headphones,Best headphones I've ever owned. Period.,5.0,2024-01-05
Samsung Galaxy Buds2 Pro,Good all-rounder but nothing exceptional,4.0,2024-01-05
Jabra Elite 85t True Wireless Earbuds,Reliable performance and good value,4.5,2024-01-05
Bose QuietComfort 35 II,Good sound but newer models offer better features,3.5,2024-01-05
